{
  "$schema": "https://json-schema.org/draft/2020-12/schema",
  "$id": "https://deep-swe-bench.local/feedback-uptake-calibration-annotation.schema.json",
  "title": "Fixed feedback candidate annotation",
  "type": "object",
  "additionalProperties": false,
  "required": [
    "annotation_schema_version",
    "candidate_set_sha256",
    "calibration_sample_sha256",
    "annotator_id",
    "annotations"
  ],
  "properties": {
    "annotation_schema_version": {"const": 1},
    "candidate_set_sha256": {"type": "string", "pattern": "^[a-f0-9]{64}$"},
    "calibration_sample_sha256": {"type": "string", "pattern": "^[a-f0-9]{64}$"},
    "annotator_id": {"type": "string", "minLength": 1},
    "annotations": {
      "type": "array",
      "minItems": 24,
      "maxItems": 24,
      "items": {"$ref": "#/$defs/annotation"}
    }
  },
  "$defs": {
    "annotation": {
      "type": "object",
      "additionalProperties": false,
      "required": [
        "candidate_unit_id",
        "candidate_disposition",
        "observation_class",
        "action_purpose",
        "next_response_label",
        "window_outcome",
        "revalidation_scope",
        "plan_revision",
        "confidence",
        "uncertainty_reasons",
        "evidence_summary"
      ],
      "properties": {
        "candidate_unit_id": {"type": "string", "minLength": 1},
        "candidate_disposition": {
          "enum": [
            "negative_feedback",
            "not_negative_feedback",
            "not_subject_visible",
            "unscorable"
          ]
        },
        "observation_class": {
          "enum": [
            "command_nonzero",
            "command_timeout",
            "negative_semantics_with_zero_status",
            "schema_invalid_tool_arguments",
            "tool_application_rejection",
            "execution_environment_failure",
            "transport_or_parser_failure",
            "observation_missing_mid_trajectory",
            "observation_missing_at_termination",
            "successful_observation",
            "unclassified",
            "not_applicable"
          ]
        },
        "action_purpose": {
          "enum": [
            "diagnostic",
            "repository_validation",
            "ad_hoc_probe",
            "mutation",
            "delivery_or_tool_mechanics",
            "setup_or_commit",
            "other",
            "indeterminate",
            "not_applicable"
          ]
        },
        "next_response_label": {
          "enum": [
            "corrective_change",
            "targeted_investigation",
            "revalidate_same",
            "retry_unchanged",
            "alternate_route",
            "continue_without_addressing",
            "terminate",
            "indeterminate",
            "not_applicable"
          ]
        },
        "window_outcome": {
          "enum": [
            "recovered",
            "progressed",
            "not_recovered",
            "indeterminate",
            "not_applicable"
          ]
        },
        "revalidation_scope": {
          "enum": [
            "same_scope",
            "broader_scope",
            "narrower_scope",
            "different_scope",
            "none",
            "not_applicable",
            "indeterminate"
          ]
        },
        "plan_revision": {
          "enum": [
            "none_observed",
            "local_adjustment",
            "strategy_revision",
            "objective_abandonment",
            "indeterminate",
            "not_applicable"
          ]
        },
        "confidence": {"enum": ["high", "medium", "low", "unscorable"]},
        "uncertainty_reasons": {
          "type": "array",
          "uniqueItems": true,
          "items": {
            "enum": [
              "parallel_feedback",
              "truncated_observation",
              "missing_observation",
              "ambiguous_scope",
              "ambiguous_relevance",
              "ambiguous_failure_signature",
              "context_window_censored",
              "missing_timestamp",
              "artifact_inconsistency",
              "other_explained"
            ]
          }
        },
        "evidence_summary": {"type": "string", "minLength": 10}
      }
    }
  }
}
