{
  "annotation_schema_version": 1,
  "candidate_set_sha256": "e6089bcdf90ec249cab3817c9a4da8cc25217f6bb3cb99f345ac5f774909d73d",
  "calibration_sample_sha256": "42ebc337026bbfdba1b132539a2815ca9eee4fb5b7f2760cb1d5f279ee28cd95",
  "annotator_id": "zai/glm-5.2:high:run-2",
  "annotations": [
    {
      "candidate_unit_id": "frontier/dateutil-rfc5545-timezone-interop/rep1/tool-call-24",
      "candidate_disposition": "negative_feedback",
      "observation_class": "command_nonzero",
      "action_purpose": "repository_validation",
      "next_response_label": "targeted_investigation",
      "window_outcome": "progressed",
      "revalidation_scope": "none",
      "plan_revision": "local_adjustment",
      "confidence": "high",
      "uncertainty_reasons": [],
      "evidence_summary": "pytest run exited code 1 with XPASS(strict) failure on test_generated_aware_dtstart_rrulestr. Agent then ran a Python probe to investigate timezone round-tripping, attempted flake8 (unavailable), and edited rrule.py to fix TZID handling. No test revalidation shown in window."
    },
    {
      "candidate_unit_id": "frontier/adaptix-name-mapping-aliases/rep1/assistant-response-42",
      "candidate_disposition": "not_subject_visible",
      "observation_class": "transport_or_parser_failure",
      "action_purpose": "delivery_or_tool_mechanics",
      "next_response_label": "not_applicable",
      "window_outcome": "not_applicable",
      "revalidation_scope": "not_applicable",
      "plan_revision": "not_applicable",
      "confidence": "high",
      "uncertainty_reasons": [],
      "evidence_summary": "WebSocket error diagnostic recorded by the harness on assistant response 42 with provider_transport_failure type. This is a transport-level event, not action feedback presented to the subject."
    },
    {
      "candidate_unit_id": "frontier/goreleaser-retry-publish-auditing/rep1/assistant-response-26",
      "candidate_disposition": "not_subject_visible",
      "observation_class": "transport_or_parser_failure",
      "action_purpose": "delivery_or_tool_mechanics",
      "next_response_label": "not_applicable",
      "window_outcome": "not_applicable",
      "revalidation_scope": "not_applicable",
      "plan_revision": "not_applicable",
      "confidence": "high",
      "uncertainty_reasons": [],
      "evidence_summary": "WebSocket idle timeout after 300000ms diagnostic on assistant response 26. A tool call (edit) had no result due to the transport failure. This is a harness transport event, not action feedback."
    },
    {
      "candidate_unit_id": "frontier/goreleaser-retry-publish-auditing/rep2/assistant-response-1",
      "candidate_disposition": "not_subject_visible",
      "observation_class": "transport_or_parser_failure",
      "action_purpose": "delivery_or_tool_mechanics",
      "next_response_label": "not_applicable",
      "window_outcome": "not_applicable",
      "revalidation_scope": "not_applicable",
      "plan_revision": "not_applicable",
      "confidence": "high",
      "uncertainty_reasons": [],
      "evidence_summary": "WebSocket connect timeout after 15000ms diagnostic before message stream start with eventsEmitted false. Transport-level failure recorded by the harness, not presented as feedback to the subject."
    },
    {
      "candidate_unit_id": "frontier/goreleaser-retry-publish-auditing/rep2/tool-call-66",
      "candidate_disposition": "negative_feedback",
      "observation_class": "command_timeout",
      "action_purpose": "repository_validation",
      "next_response_label": "targeted_investigation",
      "window_outcome": "not_recovered",
      "revalidation_scope": "none",
      "plan_revision": "local_adjustment",
      "confidence": "medium",
      "uncertainty_reasons": [
        "ambiguous_relevance"
      ],
      "evidence_summary": "go test -race timed out after 120 seconds; internal/http passed (6.999s) but other packages did not complete. Agent read Taskfile.yml then moved to schema generation. The timeout was not directly addressed in the window."
    },
    {
      "candidate_unit_id": "frontier/claude-code-by-agents-recursive-delegation/rep0/tool-call-23",
      "candidate_disposition": "negative_feedback",
      "observation_class": "command_nonzero",
      "action_purpose": "repository_validation",
      "next_response_label": "corrective_change",
      "window_outcome": "progressed",
      "revalidation_scope": "same_scope",
      "plan_revision": "local_adjustment",
      "confidence": "medium",
      "uncertainty_reasons": [
        "parallel_feedback"
      ],
      "evidence_summary": "npm run typecheck from root failed with exit code 1, missing script. Agent retried from backend directory (corrective_change), which found the script but revealed real TS errors. Multiple parallel tool calls in focal and following responses complicate attribution."
    },
    {
      "candidate_unit_id": "frontier/mobly-grouped-test-barriers/rep0/tool-call-32",
      "candidate_disposition": "negative_feedback",
      "observation_class": "tool_application_rejection",
      "action_purpose": "mutation",
      "next_response_label": "targeted_investigation",
      "window_outcome": "recovered",
      "revalidation_scope": "same_scope",
      "plan_revision": "none_observed",
      "confidence": "high",
      "uncertainty_reasons": [],
      "evidence_summary": "Edit to mobly/base_test.py rejected: could not find edits[2], oldText mismatch. Agent read relevant file sections then retried the edit with corrected oldText blocks, successfully replacing 4 blocks."
    },
    {
      "candidate_unit_id": "frontier/superjson-error-stack-serialization/rep0/tool-call-42",
      "candidate_disposition": "negative_feedback",
      "observation_class": "command_nonzero",
      "action_purpose": "mutation",
      "next_response_label": "corrective_change",
      "window_outcome": "recovered",
      "revalidation_scope": "broader_scope",
      "plan_revision": "local_adjustment",
      "confidence": "high",
      "uncertainty_reasons": [],
      "evidence_summary": "prettier --write failed exit code 2 with SyntaxError in error-stack.ts: import type used where value import needed. Agent changed the import statement, then ran prettier + build + test, all passing."
    },
    {
      "candidate_unit_id": "agentworld/goreleaser-retry-publish-auditing/rep2/tool-call-58",
      "candidate_disposition": "negative_feedback",
      "observation_class": "schema_invalid_tool_arguments",
      "action_purpose": "mutation",
      "next_response_label": "corrective_change",
      "window_outcome": "recovered",
      "revalidation_scope": "same_scope",
      "plan_revision": "none_observed",
      "confidence": "high",
      "uncertainty_reasons": [],
      "evidence_summary": "Edit tool rejected: path property nested inside edit objects instead of top-level. Agent retried with path at top level and edits containing only oldText/newText. Retry succeeded."
    },
    {
      "candidate_unit_id": "agentworld/go-critic-doc-link-checker/rep0/tool-call-104",
      "candidate_disposition": "negative_feedback",
      "observation_class": "command_nonzero",
      "action_purpose": "repository_validation",
      "next_response_label": "corrective_change",
      "window_outcome": "not_recovered",
      "revalidation_scope": "same_scope",
      "plan_revision": "local_adjustment",
      "confidence": "medium",
      "uncertainty_reasons": [],
      "evidence_summary": "go test exit code 1: unexpected warn for strings.UnknownFunction. Agent wrote updated brokenDocLink.txt fixture then reran the same test, which still failed identically."
    },
    {
      "candidate_unit_id": "agentworld/langchain-request-coalescing/rep0/tool-call-7",
      "candidate_disposition": "negative_feedback",
      "observation_class": "command_nonzero",
      "action_purpose": "diagnostic",
      "next_response_label": "targeted_investigation",
      "window_outcome": "progressed",
      "revalidation_scope": "broader_scope",
      "plan_revision": "local_adjustment",
      "confidence": "high",
      "uncertainty_reasons": [],
      "evidence_summary": "grep for class RunnableWithFallbacks in base.py returned no output, exit code 1. Agent broadened the search recursively across langchain_core/ and found the class in fallbacks.py."
    },
    {
      "candidate_unit_id": "agentworld/langchain-request-coalescing/rep0/tool-call-101",
      "candidate_disposition": "negative_feedback",
      "observation_class": "negative_semantics_with_zero_status",
      "action_purpose": "diagnostic",
      "next_response_label": "corrective_change",
      "window_outcome": "recovered",
      "revalidation_scope": "same_scope",
      "plan_revision": "local_adjustment",
      "confidence": "high",
      "uncertainty_reasons": [],
      "evidence_summary": "git diff from /app/libs/core produced fatal: ambiguous argument despite zero exit status. Agent corrected the working directory to /app and reran the same git diff, which succeeded and showed the diff."
    },
    {
      "candidate_unit_id": "agentworld/obsidian-linter-link-format-conversion/rep0/tool-call-29",
      "candidate_disposition": "not_negative_feedback",
      "observation_class": "negative_semantics_with_zero_status",
      "action_purpose": "repository_validation",
      "next_response_label": "not_applicable",
      "window_outcome": "not_applicable",
      "revalidation_scope": "not_applicable",
      "plan_revision": "not_applicable",
      "confidence": "medium",
      "uncertainty_reasons": [
        "ambiguous_relevance"
      ],
      "evidence_summary": "tsc --noEmit showed TypeScript errors only in node_modules/obsidian.d.ts (dependency type mismatch), not in the agent's source files. The signal is a false positive triggered by pre-existing dependency type issues."
    },
    {
      "candidate_unit_id": "agentworld/participle-grammar-conflict-analysis/rep0/tool-call-28",